{
  "schema_version": "0.1.0",
  "answer_type": "explanation",
  "message": "현재 결과만으로는 과적합 여부를 판단할 수 없습니다. 과적합 의심 규칙은 최소 10 epoch의 train loss, validation loss와 mAP50-95 추세를 함께 비교하지만 현재는 1 epoch 기록만 있습니다. 따라서 모델이 과적합됐다고 단정하거나 과적합 처방을 제안하지 않습니다.",
  "referenced_diagnoses": [
    "insufficient_training_history",
    "suspected_overfitting"
  ],
  "evidence": [
    {
      "source": "diagnosis",
      "diagnosis_code": "suspected_overfitting",
      "metric": "epochs_completed",
      "observed": 1,
      "comparison": "과적합 추세 판단의 최소 기준은 10 epoch입니다."
    }
  ],
  "suggested_actions": [
    {
      "type": "collect_more_training_history",
      "description": "최소 10 epoch 이상의 train·validation loss와 mAP50-95가 포함된 결과를 준비하세요.",
      "requires_approval": false
    },
    {
      "type": "rerun_analysis",
      "description": "추가 학습 결과로 과적합 의심 규칙을 다시 실행하세요.",
      "requires_approval": false
    }
  ],
  "limitations": [
    "단일 epoch만으로 train loss 감소와 validation loss 증가 추세를 계산할 수 없습니다.",
    "현재 단계에서는 augmentation, weight decay 또는 early stopping 변경 근거가 없습니다."
  ]
}
