{
  "schema_version": "0.1.0",
  "answer_type": "summary",
  "message": "현재 결과는 1 epoch 학습 기록만 포함하고 있어 모델 상태를 판단하기 어렵습니다. Precision은 0.66849, Recall은 0.65이지만 이 차이가 안정적인 모델 특성인지 판단하기에는 기록이 부족합니다. 먼저 최소 10 epoch 이상 학습한 결과를 다시 분석하는 것을 권장합니다. 현재 단계에서는 학습 설정 변경을 제안하지 않습니다.",
  "referenced_diagnoses": [
    "insufficient_training_history",
    "precision_recall_imbalance",
    "training_plateau",
    "suspected_overfitting",
    "post_peak_degradation"
  ],
  "evidence": [
    {
      "source": "diagnosis",
      "diagnosis_code": "insufficient_training_history",
      "metric": "epochs_completed",
      "observed": 1,
      "comparison": "신뢰 가능한 추세 분석 기준은 10 epoch 이상입니다."
    },
    {
      "source": "evaluation",
      "diagnosis_code": "precision_recall_imbalance",
      "metric": "precision",
      "observed": 0.66849,
      "comparison": "현재 값은 존재하지만 학습 기록 부족으로 판정을 보류합니다."
    },
    {
      "source": "evaluation",
      "diagnosis_code": "precision_recall_imbalance",
      "metric": "recall",
      "observed": 0.65,
      "comparison": "현재 값은 존재하지만 학습 기록 부족으로 판정을 보류합니다."
    }
  ],
  "suggested_actions": [
    {
      "type": "collect_more_training_history",
      "description": "최소 10 epoch 이상 학습한 YOLO 결과를 다시 업로드하세요.",
      "requires_approval": false
    },
    {
      "type": "rerun_analysis",
      "description": "새 학습 결과를 Parser와 규칙 엔진으로 다시 분석하세요.",
      "requires_approval": false
    }
  ],
  "limitations": [
    "현재 결과만으로 과적합, 학습 정체 또는 최고점 이후 성능 하락을 판단할 수 없습니다.",
    "data.yaml이 없어 클래스 기반 분석을 수행할 수 없습니다."
  ]
}
